id,trainer_id,course_code,title,certificate,description,target_audience,methodology,prerequisite,learning_objectives,learning_outcomes,category,course_mode,course_type,status,created_by_admin,course_sequence,created_by_admin.1,assessment,duration_hours,duration_unit,hrdc_claimable,modules,venue,price,fixed_date,start_date,city ,state,created_at,updated_at
f0237be7-64ea-46cd-8eca-2f1a1373ccff,34851953-d076-40e5-a836-0f9e72a484d4,TR0045C2,MICROSOFT EXCEL BASIC TO INTERMEDIATE,CERTIFICATE OF ATTENDANCE,"This two-day practical training is designed to help participants strengthen their Excel skills from foundational to intermediate level. Through guided demonstrations and hands-on exercises, participants will learn to confidently manage, analyze, and visualize data using Excels key tools and functions. The course covers essential formulas, data management techniques, charts, pivot tables, and basic automation using macros empowering participants to work smarter and more efficiently in their daily tasks.","This course is ideal for: Administrative staff, executives, and professionals who work with data or reports. Individuals with basic Excel knowledge who want to strengthen their analytical and reporting capabilities. Team members who need to organize, calculate, and present data more efficiently. Anyone looking to upgrade their Excel proficiency from basic to intermediate level to improve workplace productivity.",Interactive classroom,,"[""Upon completion of this training, participants will be able to:"", ""Apply a wide range of basic to advanced Excel functions"", ""Manage and validate large datasets effectively by implementing sorting, advanced filtering, data validation (e.g., drop-down lists), and techniques for removing duplicates."", ""Analyze data by creating and customizing Pivot Tables and Pivot Charts to summarize and interpret key information quickly."", ""Visualize data powerfully using advanced charting techniques (including combo charts and sparklines)"", ""Collaborate efficiently by protecting worksheets and workbooks and utilizing change tracking and comments features."", ""Automate repetitive tasks by recording and running basic macros and understanding fundamental VBA programming concepts and security.""]",[],Software & Apps,"[""PHYSICAL"",""ONLINE"",""HYBRID""]","[""PUBLIC"",""IN_HOUSE""]",APPROVED,0,,FALSE,FALSE,2,DAYS,FALSE,,,,,,,,04:45.3,04:45.3
e415587b-56bd-4f3d-a2ea-b16e89eb35bb,34851953-d076-40e5-a836-0f9e72a484d4,TR0045C2,MICROSOFT EXCEL BASIC TO INTERMEDIATE,CERTIFICATE OF ATTENDANCE,"This two-day practical training is designed to help participants strengthen their Excel skills from foundational to intermediate level. Through guided demonstrations and hands-on exercises, participants will learn to confidently manage, analyze, and visualize data using Excels key tools and functions. The course covers essential formulas, data management techniques, charts, pivot tables, and basic automation using macros empowering participants to work smarter and more efficiently in their daily tasks.","This course is ideal for: Administrative staff, executives, and professionals who work with data or reports. Individuals with basic Excel knowledge who want to strengthen their analytical and reporting capabilities. Team members who need to organize, calculate, and present data more efficiently. Anyone looking to upgrade their Excel proficiency from basic to intermediate level to improve workplace productivity.",Interactive classroom,,"[""Upon completion of this training, participants will be able to:"", ""Apply a wide range of basic to advanced Excel functions"", ""Manage and validate large datasets effectively by implementing sorting, advanced filtering, data validation (e.g., drop-down lists), and techniques for removing duplicates."", ""Analyze data by creating and customizing Pivot Tables and Pivot Charts to summarize and interpret key information quickly."", ""Visualize data powerfully using advanced charting techniques (including combo charts and sparklines)"", ""Collaborate efficiently by protecting worksheets and workbooks and utilizing change tracking and comments features."", ""Automate repetitive tasks by recording and running basic macros and understanding fundamental VBA programming concepts and security.""]",[],Software & Apps,"[""PHYSICAL"",""ONLINE"",""HYBRID""]","[""PUBLIC"",""IN_HOUSE""]",APPROVED,0,,FALSE,FALSE,2,DAYS,FALSE,,,,,,,,04:45.3,04:45.3
489dbe4d-9d80-481e-b508-4be520b5d59b,34851953-d076-40e5-a836-0f9e72a484d4,TR0045C3,EXCEL INTERMEDIATE,,"The ""Excel Intermediate"" one-day workshop is designed to elevate participants' proficiency in Microsoft Excel by covering essential intermediate and advanced features. This intensive course will help attendees master various functions, formulas, and data management techniques, enabling them to handle complex data tasks efficiently and effectively.",Professionals who use Excel regularly and want to enhance their skills. Data analysts and managers who need advanced Excel capabilities for their work. Individuals who have a basic understanding of Excel and wish to progress to an intermediate and advanced level.,Lectures and Demonstrations Hands-On Exercises Interactive Q&A Workshops and Group Activities Case Studies and Real-World Applications,,"[""To refresh and build upon participants' existing Excel knowledge."", ""To introduce advanced Excel functions and formulas for enhanced data analysis and management"", ""To equip participants with the skills to manage large datasets, use PivotTable features, and apply data validation and conditional formatting."", ""To enable participants to create and manage macros, link files, and import data from different formats.""]",[],Software & Apps,"[""PHYSICAL"",""ONLINE"",""HYBRID""]","[""PUBLIC"",""IN_HOUSE""]",APPROVED,0,,FALSE,FALSE,2,DAYS,FALSE,,,,,,,,04:45.3,04:45.3
d3684add-25b3-4fce-bed3-d4d5dde92a55,34851953-d076-40e5-a836-0f9e72a484d4,TR0045C4,EXCEL FORMULAS AND FUNCTION,,"The course covers a range of topics, starting with a refresher on the structure of formulas and cell references. Participants will then explore date and number formatting, advanced formula functions such as VLOOKUP, SUMIFS, and Pivot Table, and managing large tables. Advanced PivotTable features, data validation, and conditional formatting are also included, along with logical functions and worksheet protection techniques. The course concludes with creating and formatting various charts and graphs.","This course is ideal for clerical, costing, admin, executives and managers, analysts, and staff who have a basic understanding of Excel. Participants should be comfortable with data entry and navigation but seek to advance their skills in using Excel for more complex tasks such as data management, financial forecasting, costing and pricing.","The training methodology is hands-on and interactive, involving practical exercises using sample datasets that mimic real-world scenarios. Each module includes step-by-step instructions and practical applications to ensure participants can immediately apply what they learn to their daily tasks. The course also provides a training manual and reference guides to support ongoing learning and application. By the end of the course, participants will have a solid understanding of how to leverage Excels powerful features to improve efficiency, accuracy, and decision-making in their daily operations.",,"[""The Excel Function and Formula - is a comprehensive 2-day program designed to enhance the practical Excel skills of managers, analysts, and staff within the industry. This course focuses on the effective use of Excel formulas and functions to streamline operations, manage large datasets, and perform detailed data analysis, all tailored to the specific needs of your professionals.""]",[],Software & Apps,"[""PHYSICAL"",""ONLINE"",""HYBRID""]","[""PUBLIC"",""IN_HOUSE""]",APPROVED,0,,FALSE,FALSE,1,DAYS,FALSE,,,,,,,,04:45.3,04:45.3
1b7e0a1f-6e4b-491c-b074-d04cd4ca4903,34851953-d076-40e5-a836-0f9e72a484d4,TR0045C5,EXCEL INTERMEDIATE TO ADVANCE,,"The Excel Function and Formula - is a comprehensive 2-day program designed to enhance the practical Excel skills of managers, analysts, and staff within the industry. This course focuses on the effective use of Excel formulas and functions to streamline operations, manage large datasets, and perform detailed data analysis, all tailored to the specific needs of your professionals.","This course is ideal for clerical, costing, admin, executives and managers, analysts, and staff who have a basic understanding of Excel. Participants should be comfortable with data entry and navigation but seek to advance their skills in using Excel for more complex tasks such as data management, financial forecasting, costing and pricing.","The training methodology is hands-on and interactive, involving practical exercises using sample datasets that mimic real-world scenarios. Each module includes step-by-step instructions and practical applications to ensure participants can immediately apply what they learn to their daily tasks. The course also provides a training manual and quick reference guides to support ongoing learning and application. By the end of the course, participants will have a solid understanding of how to leverage Excels powerful features to improve efficiency, accuracy, and decision-making in their daily operations.",,[],[],Software & Apps,"[""PHYSICAL"",""ONLINE"",""HYBRID""]","[""PUBLIC"",""IN_HOUSE""]",APPROVED,0,,FALSE,FALSE,2,DAYS,FALSE,,,,,,,,04:45.3,04:45.3
6a04370a-2fb4-49cd-9f4c-74e9be259dd9,34851953-d076-40e5-a836-0f9e72a484d4,TR0045C6,INTRODUCTION TO MICROSOFT EXCEL BASIC,,,,,,[],[],Software & Apps,"[""PHYSICAL"",""ONLINE"",""HYBRID""]","[""PUBLIC"",""IN_HOUSE""]",APPROVED,0,,FALSE,FALSE,2,DAYS,FALSE,,,,,,,,04:45.3,04:45.3
e6001ab1-b67e-4055-995b-dc3b12f92291,34851953-d076-40e5-a836-0f9e72a484d4,TR0045C7,MICROSOFT EXCEL ADVANCED LEVEL,,,,,,[],[],Software & Apps,"[""PHYSICAL"",""ONLINE"",""HYBRID""]","[""PUBLIC"",""IN_HOUSE""]",APPROVED,0,,FALSE,FALSE,1,DAYS,FALSE,,,,,,,,04:45.3,04:45.3
cc8590fa-6b4a-4756-9c56-7091815bf462,34851953-d076-40e5-a836-0f9e72a484d4,TR0045C8,EXCEL INTERMEDIATE,,,,,,[],[],Software & Apps,"[""PHYSICAL"",""ONLINE"",""HYBRID""]","[""PUBLIC"",""IN_HOUSE""]",APPROVED,0,,FALSE,FALSE,1,DAYS,FALSE,,,,,,,,04:45.3,04:45.3
dcc0ab31-5256-40b9-8033-3d37d890a5ff,0,TR0047C1,SAFE CHEMICAL HANDLING AND GHS TRAINING,CERTIFICATE OF ATTENDANCE,This training aims to develop the ability to assess chemical usage in the workplace and to apply basic chemical principles to manage identified risks and prevent occupational and work-related injuries and illnesses,Contribute to the Development of Chemical Awareness for the People. Increase Knowledge of Chemical Management. Elevate Awareness in Recognizing Signs and Symptoms of Potentials Illness. Increase Ways to Reduce Psychological Stress and Trauma through Peer Support. Discuss Key Concepts Related to Chemicals. Recognize When to Facilitate Access to Further Chemical support. Practice Self-care,Classroom Practical Assessment,,"[""Contribute to the Development of Chemical Awareness for the People."", ""Increase Knowledge of Chemical Management."", ""Elevate Awareness in Recognizing Signs and Symptoms of Potentials Illness."", ""Increase Ways to Reduce Psychological Stress and Trauma through Peer Support."", ""Discuss Key Concepts Related to Chemicals."", ""Recognize When to Facilitate Access to Further Chemical support."", ""Practice Self-care""]","[""Improves Knowledge of Appropriate Chemicals."", ""Chemical Skills in Supporting People in Acute Distress."", ""Enhancing Self-Efficacy and Promoting Resilience."", ""To Enhance the Prospect of Client Facilities with International Standard for Revenue""]",Human Resource,"[""PHYSICAL"",""ONLINE"",""HYBRID""]","[""PUBLIC"",""IN_HOUSE""]",APPROVED,0,,FALSE,FALSE,2,DAYS,FALSE,,,,,,,,04:45.3,04:45.3
19b925bf-e2c7-4c3d-a81c-3f6f668a7b0e,0,TR0047C2,Working At Height Training,,"Work at height"" refers to any activity performed in an area where, in the absence of safety measures, an individual may fall a distance that could result in personal injury (for example a fall through a weak roof). Employers can lower the chance that any of their employees will fall when working at a height by implementing a few easy but effective steps",Managers/ Executives Safety and Health Officers OSH Practitioners Safety and Health Committee Members Supervisors and all levels of workers,Classroom Practical Assessment,,"[""Contribute To The Development Of Working At Height For The Crew."", ""Increase Knowledge on Working At Height Management."", ""Elevate Awareness In Recognizing Signs And Symptoms Of Emergencies."", ""Increase Ways to Improve Working At Height through Peer Support."", ""Discuss key concepts related to Working At Height."", ""Recognize when to facilitate access to further Working At Height support."", ""Practice self-care""]","[""Improves Knowledge Of Appropriate Working At Height Response."", ""Working At Height Skills in Supporting People in Acute Distress."", ""Enhancing Self-Efficacy and Promoting Resilience."", ""To Enhance The Prospect Of Client Facilities With International Standard For Revenue""]",Human Resource,"[""PHYSICAL"",""ONLINE"",""HYBRID""]","[""PUBLIC"",""IN_HOUSE""]",APPROVED,0,,FALSE,FALSE,2,DAYS,FALSE,,,,,,,,04:45.3,04:45.3
7a7c6223-b204-4ed5-800a-5caf40384c4e,b1a6ba2d-7aed-4a65-9fee-13c1158a1ceb,TR0051C1,BASIC OCCUPATIONAL FIRST AID & CPR,,"Accident and Emergencies can happen anywhere and anytime. The likelihood of this happening in the work place increases significantly especially when the work involved in hazardous and dangerous. Loss of productive time, personnel and money is a very well recognized aftermath. Casualties succumb to their injuries before they reach medical facility and the company loses its most skillful, productive hand. Fortunately, this is preventable with proper training. Proper handling of accident victims contributes significantly to the final out for this victim. It is for these reasons we propose the Occupational Emergency First Aid, Cardiopulmonary Resuscitation (CPR) and Basic Emergency First Response Team Level 3 (BEFRT) program for your organization.",The program is open to all and has no entry requirements.,"The program is delivered via lectures, skill and practical sessions with the use of audio visual aids where necessary. Open discussions are encouraged. Lecturers and instructors are fully qualified medical and paramedical professionals fully trained and experienced in emergency rescue.",,"[""On successful completion of this program, the candidate will be able to deliver"", ""emergency care services as a first aider or emergency response team skillfully in your"", ""organization.""]",[],Others,"[""PHYSICAL"",""ONLINE"",""HYBRID""]","[""PUBLIC"",""IN_HOUSE""]",APPROVED,0,,FALSE,FALSE,2,DAYS,FALSE,,,,,,,,04:45.3,04:45.3
1cca2d60-86d2-485f-b6f6-2e696beae504,0,TR0052C1,BASIC FIRST AID AND CPR AED,,"In our daily lives, emergencies can occur at any time and place, requiring immediate and effective intervention to save lives and prevent further injury. This training program on basic first aid and Cardiopulmonary Resuscitation (CPR) is designed to equip participants with essential skills and knowledge to handle such critical situations confidently and competently. Whether in the workplace, at home, or in public spaces, being prepared to provide first aid and CPR can make a significant difference in the outcome of an emergency",,,,"[""Define basic first aid and CPR."", ""Identify various kinds of emergencies that need immediate intervention."", ""Identify the steps of basic first aid and CPR.""]","[""After completing the training, you should be able to:"", ""Define basic first aid and CPR."", ""Identify various kinds of emergencies that need immediate intervention."", ""Identify the steps of basic first aid and CPR.""]",Others,"[""PHYSICAL"",""ONLINE"",""HYBRID""]","[""PUBLIC"",""IN_HOUSE""]",APPROVED,0,,FALSE,FALSE,2,DAYS,FALSE,,,,,,,,04:45.3,04:45.3
40578809-da22-4693-886e-45439517ade4,271fac85-c48d-4d81-acfa-1f345bde120f,TR0055C1,MASTERING THE 6 LEADERSHIP STYLES: KNOWLEDGE AND REAL PRACTICE,CERTIFICATE OF ATTENDANCE ,"This training program aims to equip participants with a comprehensive understanding of Daniel Goleman's six leadership styles, enabling them to apply these styles effectively within their organizations. By mastering these styles, leaders can enhance their leadership effectiveness, adapt to various situations, and improve team performance and morale.","The training is designed for mid to senior-level managers, team leaders, and aspiring leaders who wish to develop their leadership skills and adapt their management style to different contexts",Methodology: Presentation Brainstorming Role-play Games/Activities,Participants with minimum 3 years experiences in leader position,"[""By the end of this training, participants will be able to:"", ""Identify and describe Daniel Goleman's six leadership styles."", ""Understand the appropriate contexts and situations for applying each leadership style."", ""Assess their own dominant leadership style and recognize areas for improvement."", ""Develop strategies to incorporate multiple leadership styles into their leadership approach.""]","[""Participants will have a knowledge and practical skills in applying different leadership based on the goals in daily life and workplace""]",Leadership & Management Skills,"[""PHYSICAL"",""ONLINE"",""HYBRID""]","[""PUBLIC"",""IN_HOUSE""]",APPROVED,0,,FALSE,FALSE,2,DAYS,FALSE,,,,,,,,04:45.3,04:45.3
a32d4c96-3dc4-44a9-9a58-8ab8080bf2ed,0,TR0056C1,CHALLENGES IN ACQUIRING ASSETS IN STRATA DEVELOPMENT,CERTIFICATE OF ATTENDANCE,"The training ""Challenges in Acquiring Assets in Strata Development"" is designed to address the complexities and intricacies involved in acquiring and managing strata assets. Strata development presents unique challenges, including understanding the different types of property ownership, management entities, and the legal and practical considerations necessary for successful acquisition and management. This training aims to equip participants with the knowledge and skills needed to navigate these challenges effectively.",Suitable for departments that involve in buying built strata development and management.,Lectures and Presentations Case Studies Group Discussions Practical exercises,Participants should have a fundamental understanding of real estate principles and practices. Prior experience in property management or related fields will be beneficial but not mandatory. A keen interest in strata development and asset management will enhance the learning experience.,"[""To understand the fundamental concepts of strata development, including ownership, management, and property classification."", ""To identify and analyze the key challenges in acquiring strata assets."", ""To develop practical skills for conducting pre-acquisition due diligence."", ""To comprehend the legal frameworks governing strata properties and their implications for asset acquisition and management."", ""To apply knowledge of strata development to real-world scenarios, ensuring informed decision-making and effective asset management.""]","[""Comprehensive Understanding of Strata Development: Participants will gain a thorough understanding of the fundamentals of strata development, including"", ""ownership structures, management entities, and property classifications."", ""Enhanced Due Diligence Skills: Participants will learn to conduct detailed pre-acquisition due diligence, identifying potential risks and challenges in acquiring strata assets."", ""Legal and Practical Knowledge: Participants will understand the legal aspects of strata development, including bylaws, covenants, and the process of strata title"", ""application and alteration."", ""Effective Asset Management: Participants will develop skills to manage strata assets effectively, including dealing with service charges, sinking funds, and contributions.""]",Leadership & Management Skills,"[""PHYSICAL"",""ONLINE"",""HYBRID""]","[""PUBLIC"",""IN_HOUSE""]",APPROVED,0,,FALSE,FALSE,,DAYS,FALSE,,,,,,,,04:45.3,04:45.3
0937840b-9809-451f-a7b6-771aa7d9cac6,0,TR0056C2,"OVERVIEW OF HOUSING DEVELOPMENT ACT, STRATA TITLE ACT & STRATA MANAGEMENT ACT ON STRATA HOUSING DEVELOPMENT AND MANAGEMENT",CERTIFICATE OF ATTENDANCE,"The module ""Overview of Housing Development Act, Strata Title Act & Strata Management Act on Strata Housing Development and Management"" provides a comprehensive understanding of the legal framework governing strata housing development and management. This training is essential for professionals involved in planning, managing, or overseeing built strata developments. The course covers the historical context, key changes, and current challenges in implementing these laws, offering practical insights and solutions for effective strata management.",Suitable for departments that involve in planning and building a strata development,Lectures and Presentations Case Studies Group Discussions Hands-on Exercises,Participants should have a fundamental understanding of real estate principles and practices. Prior experience in property management or related fields will be beneficial but not mandatory. A keen interest in strata development and asset management will enhance the learning experience.,"[""To understand the historical development and key provisions of the Housing Development Act (HDA), Strata Title Act (STA), and Strata Management Act (SMA)."", ""To identify and analyze the significant amendments to these laws and their impact on strata housing development and management."", ""To gain practical knowledge of the procedures and regulations during the pre-sale, sale, construction, and vacant possession periods."", ""To develop strategies for overcoming current challenges in strata development and management.""]","[""Comprehensive Legal Knowledge: Participants will acquire a thorough understanding of the HDA, STA, and SMA, including their historical context and key regulations."", ""Amendment Awareness: Participants will be able to identify and comprehend the recent amendments to these laws and understand their implications on various stages of"", ""strata development."", ""Practical Application: Participants will learn to apply legal knowledge to real-world scenarios, ensuring compliance with statutory requirements during pre-sale, sale, construction,"", ""and vacant possession periods."", ""Problem-Solving Skills: Participants will develop the ability to address and resolve challenges in strata development and management, utilizing legal frameworks and best practices.""]",Leadership & Management Skills,"[""PHYSICAL"",""ONLINE"",""HYBRID""]","[""PUBLIC"",""IN_HOUSE""]",APPROVED,0,,FALSE,FALSE,2,DAYS,FALSE,,,,,,,,04:45.3,04:45.3
9f097e29-62a2-4566-8c6f-d7041df014c0,,TR0057C1,MASTERING YOUR COMMUNICATION,,,"Working professionals (all levels) Anyone who is keen on personal growth and professional development Anyone who wants to be a public speaker Anyone who wants to be an effective communicator, leader, or coach","Methodology: Full Immersion, experiential learning Presentation, group discussion Practical examples, real-life experiences Activities, exercises & role-plays NLP techniques of communication",,"[""Training Objectives:"", ""In the 2-day NLP workshop participants will learn how:"", ""To reprogram subconscious mind to achieve success and happiness"", ""To develop all areas of leadership, including better communication, conflict management, influence and persuasion, problem solving, critical thinking, negotiation, decision making, increased EQ, goals setting and more"", ""To enhance your personal growth, all with the successful application of NLP techniques.""]","[""Improve emotional connections"", ""Communicate with confidence"", ""Captivate attention, influence, persuade and negotiate for win-win"", ""Design powerful presentations and business pitches"", ""Develop rapport and inspire trust"", ""Be an effective communicator, leader and/or coach""]",Software & Apps,"[""PHYSICAL"",""ONLINE"",""HYBRID""]","[""PUBLIC"",""IN_HOUSE""]",APPROVED,0,,FALSE,FALSE,2,DAYS,FALSE,,,,,,,,04:45.3,04:45.3
