id,trainer_id,course_code,title,certificate,description,target_audience,methodology,prerequisite,learning_objectives,learning_outcomes,category,course_mode,course_type,status,created_by_admin,course_sequence,created_by_admin.1,assessment,duration_hours,duration_unit,hrdc_claimable,modules,venue,price,fixed_date,start_date,city ,state,created_at,updated_at
77df78f4-2ffb-4b75-86b5-5540adfa563b,,TR0000,INNOVATION & CREATIVE THINKING,,"The key ingredient of Leadership today is all about coping with change. Change can be initiated and based on different situations or events, or sometimes aspirations. It can be NECESSARY, or induced by AMBITION, by something OUTSIDE or something INSIDE our company, it can be NATURAL or it can be FORCED. In Order to cope with change, you need to be creative, innovative, a problem solver and an effective communicator. In this 2 days program, you will learn what is change all about, how to break change resistance, how to think differently in order to win, progress and solve problems. You will be introduced to various case studies from history, from successful companies that adopt to change with induced innovation & creativity and also companies that disappeared when they refused to move out from their comfort zone. This course is unique because it focuses a lot on history, stories, plenty of case studies and videos. Most of the slides here are only pictures with a lot of deep meaning. You are assured to learn plenty from this class & people will go back highly motivated with the desire to use creative thinking to change something for the best in order to be competitive, profitable & continuously improving to delight themselves & their customers","Engineers Managers, Supervisors Shop floor personnel Continuous improvement personnel Team leaders Executives Change agents","informative presentation, Group discussion & Presentations, Real Case Studies, Discussions & Brainstorming Sessions, Video Presentations.",,"[""Understand what is change and the importance of change."", ""Learn how to break change resistance by changing the mindset and adapting to change."", ""Be able to implement creative thinking."", ""Be able to be a good influencer & establish great change agents ."", ""Go back highly motivated"", ""Be a creative problem solver""]","[""Understand what is change and the importance of change."", ""Learn how to break change resistance by changing the mindset and adapting to change."", ""Be able to implement creative thinking."", ""Be able to be a good influencer & establish great change agents ."", ""Go back highly motivated"", ""Be a creative problem solver""]",Others,"[""PHYSICAL"",""ONLINE"",""HYBRID""]","[""PUBLIC"",""IN_HOUSE""]",APPROVED,0,,FALSE,FALSE,2,DAYS,FALSE,,,,,,,,04:45.3,04:45.3
5983067f-0b58-4cae-bc94-acb7956ee83c,,TR0000,8D PROBLEM SOLVING,Certificate of Attendance,"At many times, problems are not defined clearly, decisions are only based on assumptions or hunches anda systematic approach is not used. Because of all these issues, the 8-Disciplines Problem Solving Technique or 8D was pioneered by the Ford Motor Company and is commonly used to solve complex problems. It provides a systematic and effective approach to solve a problem and promotes the use of expertise and experience within the organization to address the root cause. 8D uses composite problem-solving methodology, by borrowing tools and techniques from various approaches. This workshop will use an 80% practical hands-on & 20% theory approach","Engineers, managers, supervisors, manufacturing personnel, quality personnel, safety personnel, maintenance, continuous improvement personnel, team leaders and executives who are responsible in analyzing and solving a problem.","Informative presentation, Group Activities, Discussions & Presentations, Real Case Studies, One segment of practical 8D Problem Solving (80% Practical Activities)",,"[""Use structured problem solving and corrective action methodology based on the 8D process"", ""model."", ""Enhance organizational ability to trace a problem to the root cause level."", ""Incorporate applicable QC tools within the 8D process.""]","[""Effectively implement these disciplines in your organization"", ""Develop action plans to perform problem solving activities using the 8D methodology."", ""Promote multidisciplinary team approach and a strong problem-solving culture."", ""Eliminate repeated problems and coming up with lasting solutions.""]",Others,"[""PHYSICAL"",""ONLINE"",""HYBRID""]","[""PUBLIC"",""IN_HOUSE""]",APPROVED,0,,FALSE,FALSE,2,DAYS,FALSE,,,,,,,,04:45.3,04:45.3
34122010-3757-423b-814a-c0e9381466f3,,TRFRC1,AI-POWERED TRANSFORMATION: UNLOCKING EFFICIENCY FOR SECRETARIAL AND ADMINISTRATIVE PROFESSIONALS,CERTIFICATE OF ATTENDANCE,"In todays rapidly evolving digital landscape, secretarial and administrative roles are transforming from traditional support functions to strategic enablers. This course is designed to empower professionals in these roles with cutting-edge AI tools and automation techniques, equipping them to enhance productivity, streamline workflows, and add greater value to their organizations. Participants will gain practical insights into how AI and automation can revolutionize their day-to- day tasks and future-proof their careers in an increasingly tech-driven world.","Executive Assistants, Personal Assistants, and Administrative Professionals. Office Managers and Secretarial Staff. Professionals responsible for managing workflows, documentation, and communications.",Classroom Group activity,"To ensure an optimal learning experience, participants should: Have basic computer literacy (e.g., familiarity with Microsoft Office or Google Workspace). Be comfortable navigating common digital tools like email and cloud-based file storage. Have a willingness to learn and adapt to new technology. Have access to Microsoft Power Automate web and desktop with the appropriate license (included in most Microsoft 365 subscriptions, such as Business Standard or higher). No prior knowledge of AI or automation is required. All concepts and tools will be explained in simple, practical terms, with step-by-step guidance during hands-on sessions.","[""Understand the fundamentals of AI and its applications in administrative workflows."", ""Identify opportunities for AI and automation to optimize routine tasks."", ""Gain hands-on experience with free tools like Microsoft Power Automate and AI-based"", ""software for task management, communication, and document handling."", ""Develop a personalized action plan for implementing AI-driven solutions in their roles.""]","[""Familiarise with AI tools for administrative tasks."", ""Understand how to design and deploy simple automation workflows using tools like Power"", ""Automate to reduce lower value tasks."", ""Transition from a support-focused role to a strategic contributor within their organization."", ""Be equipped to continuously adapt to new technologies and lead transformation initiatives.""]",Software & Apps,"[""PHYSICAL"",""ONLINE"",""HYBRID""]","[""PUBLIC"",""IN_HOUSE""]",APPROVED,0,,FALSE,FALSE,2,DAYS,FALSE,,,,,,,,04:45.3,04:45.3
529f54a1-f6a7-468e-80cd-0fedfe88245d,,TR0000,,,,,,,[],[],Others,"[""PHYSICAL"",""ONLINE"",""HYBRID""]","[""PUBLIC"",""IN_HOUSE""]",APPROVED,0,,FALSE,FALSE,1,DAYS,FALSE,,,,,,,,04:45.3,04:45.3
9f60dc0e-1941-43b0-81d9-da1a5978fac7,,TR0000,,,,,,,[],[],Others,"[""PHYSICAL"",""ONLINE"",""HYBRID""]","[""PUBLIC"",""IN_HOUSE""]",APPROVED,0,,FALSE,FALSE,1,DAYS,FALSE,,,,,,,,04:45.3,04:45.3
b48b03e9-733c-42a4-89a5-c6802f781724,,TR0001C1,LEAN MANUFACTURING,CERTIFICATE OF ATTENDANCE,"This workshop must be attended if your operations need to become more responsive to your customers needs. You will be introduced to the many concepts that fall under the umbrella of lean, more so you will also get tangible ideas that you can take back to work and implement. Lean is a process that can help you to substantially reduce inventories, Work-In-Process, required floor space, cycle times and lead times. It can also dramatically improve quality connecting processes and people to allow errors to be caught faster.","Change Agents, CI Personnel, Supervisors, Managers, Engineers, Executives, or anyone who wants to make process improvements","Informative presentation, Group discussion & Presentations, Real Case Studies & Video Presentations, Value Analysis Activities",,"[""Be able to analyze value"", ""Serve as an eye-opener to see & attack waste"", ""To be able to start lean transformation projects which are effective"", ""Learn the lean culture"", ""To reduce lead time"", ""To be relevant in the eyes of the customer by providing value added services""]","[""Understand and implement lean activities"", ""Able to understand wastes in the shop-floor"", ""Able to differentiate between value and non-value added activities in order to transform to"", ""become a lean organization""]",Manufacturing,"[""PHYSICAL"",""ONLINE"",""HYBRID""]","[""PUBLIC"",""IN_HOUSE""]",APPROVED,0,,FALSE,FALSE,1,DAYS,FALSE,,,,,,,,04:45.3,04:45.3
f9e5fe2a-ddc4-4f8f-b57e-e9ea46805eac,,TR0001C2,LEAN MANUFACTURING,CERTIFICATE OF ATTENDANCE,"This workshop must be attended if your operations need to become more responsive to your customers needs. You will be introduced to the many concepts that fall under the umbrella of lean, more so you will also get tangible ideas that you can take back to work and implement. Lean is a process that can help you to substantially reduce inventories, Work-In-Process, required floor space, cycle times and lead times. It can also dramatically improve quality connecting processes and people to allow errors to be caught faster.","Change Agents, CI Personnel, Supervisors, Managers, Engineers, Executives, or anyone who wants to make process improvements","Informative presentation, Group discussion & Presentations, Real Case Studies & Video Presentations, Lean Simulations, Line Tours & Learnings for In-House, Individual Activities on Waste Analysis",,"[""Be able to analyse value"", ""Serve as an eye-opener to see & attack waste"", ""To be able to start lean transformation projects which are effective"", ""Learn the lean culture"", ""To reduce lead time"", ""To be relevant in the eyes of the customer by providing value added services""]","[""Understand and implement lean activities"", ""Able to identify wastes in the shop-floor- to generate lean project ideas"", ""Able to differentiate between value and non-value added activities in order to transform to"", ""become a lean organization"", ""Able to understand all the tools of Lean such as Poka-Yoke, SMED, Jidoka, 5S, Pull System,"", ""Cellular Manufacturing, One-Piece Flow, JIT & many more""]",Manufacturing,"[""PHYSICAL"",""ONLINE"",""HYBRID""]","[""PUBLIC"",""IN_HOUSE""]",APPROVED,0,,FALSE,FALSE,2,DAYS,FALSE,,,,,,,,04:45.3,04:45.3
bbc7f2f1-b691-47ad-bc1f-94d05b93b64b,,TR0002C1,E-INVOICING,CERTIFICATE OF ATTENDANCE,"The Inland Revenue Board of Malaysia (IRBM) has officially announced the phased implementation of the new Electronic Invoice (e-invoice) system, marking a pivotal shift in business transactions.Under Section 82 of the Income Tax Act 1967, e invoicing will gradually roll out starting from August 1, 2024, with full enforcement slated for 2025.This initiative aims to bolster efficiency in business transactions and compliance with tax regulations, impacting sole proprietors, private limited companies, and a spectrum of businesses involved in goods and services trade. Recognizing the significant shift, this e-invoice course offers a comprehensive checklist, delving into crucial aspects such as software capabilities, self-billing procedures, consolidated e-invoicing methods, disbursement, and reimbursement protocols, management of employee benefits and expense claims, buyer request options, and the requisite IT infrastructure and more.",CFO Accounts Manager Accounts Executive Accounts Assistant Operation Manager Sales Manager Shiff Operation Manager,Real case studies IRB Guideline Interactive Power Point Q&A for each module,,"[""This training helps business owners, accountants, finance professionals,"", ""and bookkeepers regarding the intricacies of accounting in the e-invoicing era."", ""By providing comprehensive guidance and practical insights, attendees will be"", ""equipped with the knowledge and skills necessary to effectively manage"", ""business and accounting processes amidst the transition to electronic invoicing,"", ""thereby minimizing disruptions and maximizing operational efficiency.""]","[""Understanding what is E-Invoicing"", ""The E-Invoicing rules in Malaysia 0002"", ""Benefits of E-Invoicing"", ""E-Invoicing process description"", ""E-Invoice implementation timeline"", ""E-Invoicing: Impact on strategies and operations"", ""(And, with Latest Updates)""]",Accounts & Finance,"[""PHYSICAL"",""ONLINE"",""HYBRID""]","[""PUBLIC"",""IN_HOUSE""]",APPROVED,0,,FALSE,FALSE,1,DAYS,FALSE,,,,,,,,04:45.3,04:45.3
3e917747-ee34-4704-ae78-45ef460f8ea2,0,TR0003C1,LOGISTICS MANAGEMENT,,,Supply Chain and Logistics Professionals ProfessionalsSenior and Mid-Level Supply Chain Managers Executives Manufacturing Managers Customer Service Managers Procurement Managers,,,[],[],Logistics & Supply Chain,"[""PHYSICAL"",""ONLINE"",""HYBRID""]","[""PUBLIC"",""IN_HOUSE""]",APPROVED,0,,FALSE,FALSE,2,DAYS,FALSE,,,,,,,,04:45.3,04:45.3
970188f5-fd2f-4f22-a211-8d1fe1d64030,0,TR0003C2,Logistics and Inventory Management,,,,,,[],[],Logistics & Supply Chain,"[""PHYSICAL"",""ONLINE"",""HYBRID""]","[""PUBLIC"",""IN_HOUSE""]",APPROVED,0,,FALSE,FALSE,2,DAYS,FALSE,,,,,,,,04:45.3,04:45.3
88c4aae9-b988-4dc8-8507-f88f5e2b113a,0,TR0004C1,MANAGER DEVELOPMENT PROGRAM,CERTIFICATE OF ATTENDANCE,"This intensive two-day course is structured to equip managers with advanced skills in critical thinking, communication, and negotiation, essential for leading high-performing teams and driving organizational success. Through a mix of interactive lectures, practical workshops, role-playing, and group discussions, participants will be encouraged to explore new strategies, reflect on their current practices, and commit to actionable steps for improvement.",Mid-level Managers Aspiring Managers Team Leaders Department Heads Supervisors,Lectures and Presentations Interactive Exercises Group Discussions: Role-Playing Simulations,,"[""To deepen manager s understanding and application of critical thinking for enhanced decision-making."", ""To elevate communication skills for impactful leadership and effective team dynamics."", ""To advance negotiation skills for resolving conflicts and fostering collaborative solutions.""]","[""Demonstrate improved critical thinking abilities, applying systematic approaches to problem- solving and decision-making."", ""Exhibit advanced communication skills, including listening, feedback, persuasion, and adaptation to various contexts and audiences."", ""Apply strategic negotiation techniques to manage conflicts effectively and negotiate successful outcomes.""]",Software & Apps,"[""PHYSICAL"",""ONLINE"",""HYBRID""]","[""PUBLIC"",""IN_HOUSE""]",APPROVED,0,,FALSE,FALSE,2,DAYS,FALSE,,,,,,,,04:45.3,04:45.3
b076af9e-7d56-43c6-8da3-bdeb5ac0df7e,0,TR0004C2,Problem Solving and Interpersonal Skills: A Critical Mind at Workplace,,"This course is structured to address the dual aspects of problem-solvingt echniques and the development of interpersonal skills, offering acomprehensive approach to navigating workplace challenges. Through interactive sessions, practical exercises,andreal-life case studies, participants willl earn to apply critical thinking for problem-solving and enhance their communication, empathy, and collaboration skills.",,,,"[""To develop participants' problem-solving abilities using structured methodologies."", ""To enhance interpersonal skills,including communication, empathy, and teamwork."", ""To equip participants with strategies for effective conflict resolution and negotiation.""]","[""Identify and apply effective problem-solving techniques in a variety of contexts."", ""Communicate clearly and effectively in both one-on-one and team settings."", ""Utilizeemotionalintelligencetobuildstrong professional relationships."", ""Develop critical thinking skills for effective decision-making""]",Team Building,"[""PHYSICAL"",""ONLINE"",""HYBRID""]","[""PUBLIC"",""IN_HOUSE""]",APPROVED,0,,FALSE,FALSE,1,DAYS,FALSE,,,,,,,,04:45.3,04:45.3
6548b290-2b3f-488a-821b-6ac613a9b384,2e1976a6-80d0-494b-9b72-339d2c5a3aa9,TR0005C1,MICROSOFT EXCEL (BASIC),CERTIFICATE OF ATTENDANCE,"Welcome to the Excel Basic Training program, your gateway to mastering essential spreadsheet skills. In this course, we'll delve into fundamental topics starting with Basic Data Entry, where you'll learn the ins and outs of inputting information accurately. We'll then explore the art of Data Formatting, guiding you in presenting your data with clarity and visual appeal. Formula Basics will empower you with calculation prowess, while strategies for Working with Rows and Columns ensure seamless data organization. As we journey further, you'll gain proficiency in Editing Worksheets, refining your data with precision, and conclude by mastering the intricacies of Printing Worksheets for effective on- screen and paper presentation. Whether you're a novice or an experienced user, this course is tailored to elevate your Excel skills, providing a solid foundation and refining your expertise. Join us for this transformative learning experience, and let's embark together on the path to Excel mastery!",Office admin Senior Executive & Managers Engineers,Face-to-Face or Online Hands-on exercises,The minimum Excel version is Microsoft Excel 2016,"[""Develop proficiency in Basic Data Entry"", ""Master Data Formatting techniques"", ""Acquire strategies for Working with Rows and Columns"", ""Enhance skills in Editing Worksheets""]","[""Participants able to ensure accurate and organized information input for effective"", ""spreadsheet management"", ""Participants can present information visually and comprehensibly for enhanced data"", ""representation"", ""Participants able to organize and manipulate data efficiently"", ""Participants can modify and refine data with precision and efficiency""]",Software & Apps,"[""PHYSICAL"",""ONLINE"",""HYBRID""]","[""PUBLIC"",""IN_HOUSE""]",APPROVED,0,,FALSE,FALSE,1,DAYS,FALSE,,,,,,,,04:45.3,04:45.3
e0e54855-16b2-4fd1-8a38-9f27eb229f13,2e1976a6-80d0-494b-9b72-339d2c5a3aa9,TR0005C2,MICROSOFT POWER BI,ATTENDANCE CERTIFICATE,"If you're not already familiar with it, Power BI is a powerful business intelligence tool that enables you to create visually appealing and interactive reports and dashboards. With this tool, you can easily analyze your business data and gain insights that will help you make more informed decisions. The aim of this training program is to provide beginners with a comprehensive understanding of Power BI and its features.",This training program is intended for individuals with little or no experience in Power BI who are looking to gain the necessary skills to effectively use the tool for data visualization and business intelligence purposes.,"The training will be delivered through a combination of lectures, hands-on exercises, and real-world projects. The lectures will introduce participants to the various features and functionality of Power BI, while the hands-on exercises will allow participants to apply their knowledge and gain practical experience. The real-world projects will provide participants with an opportunity to apply their skills to a real-life scenario.","Basic computer skills, including proficiency in using Windows operating system, web browsers, and Microsoft Office applications Familiarity with basic data concepts such as tables, columns, and rows Understanding of basic statistical concepts such as averages, percentages, and standard deviations Familiarity with data visualization concepts such as charts, graphs, and tables","[""Connect and import data from various sources into Power BI"", ""Create and format basic visualizations such as charts, tables, and maps"", ""Create interactive dashboards and reports"", ""Apply data transformations using DAX formulas"", ""Share and publish Power BI reports and dashboards""]","[""Participants will be able to use Power Query Editor to prepare a proper dataset for their"", ""analysis"", ""Participants will be able to use Power BI Desktop to generate their data analysis"", ""Participants will be able to publish and share their reports in Power BI Service""]",Software & Apps,"[""PHYSICAL"",""ONLINE"",""HYBRID""]","[""PUBLIC"",""IN_HOUSE""]",APPROVED,0,,FALSE,FALSE,2,DAYS,FALSE,,,,,,,,04:45.3,04:45.3
a2cff163-2e05-4eb2-9917-ef2c3fa78de8,2e1976a6-80d0-494b-9b72-339d2c5a3aa9,TR0005C3,DATA ANALYSIS AND DASHBOARD REPORTING USING MICROSOFT EXCEL,CERTIFICATE OF ATTENDANCE,"This course will help the participant to create customized dashboard in Excel. A business or digital dashboard in the simplest terms, is a display of metrics in numeric or graphical form. These metrics or what is commonly referred to as measures, range widely depending on the customer and type of organization. Towards the end of the program, participants will create a working dashboard.",Experienced users committed to upgrading their skills in EXCEL especially on creating their own dashboards.,Classroom,"Familiarity with using a personal computer, mouse, and keyboard Comfortable in using Windows environment Ability to launch and close programs Navigate to information stored in the computer Manage files and folders Have basic Microsoft Excel skills","[""Participants will discover advanced EXCEL dashboards creation techniques and strategies"", ""to improve their EXCEL competency level.""]","[""Participants will demonstrate advanced EXCEL skills to create and display their own custom"", ""dashboards with minimum error.""]",Software & Apps,"[""PHYSICAL"",""ONLINE"",""HYBRID""]","[""PUBLIC"",""IN_HOUSE""]",APPROVED,0,,FALSE,FALSE,2,DAYS,FALSE,,,,,,,,04:45.3,04:45.3
974d101d-adc8-4529-a09e-138fef1d0cd3,2e1976a6-80d0-494b-9b72-339d2c5a3aa9,TR0005C4,AUTODESK AUTOCAD 2D FUNDAMENTALS,CERTIFICATE OF ATTENDANCE,The purpose of this training proposal is to outline a comprehensive training program for individuals who are new to AutoCAD 2D software. The program is designed to provide participants with the foundational knowledge and skills needed to use the software effectively and produce basic 2D drawings.,"This training program is designed for individuals who are new to AutoCAD 2D software and do not have prior experience using the software. This includes engineers, architects, drafters, and other professionals who need to use the software to produce basic drawings.","The training program will be delivered through a combination of lectures, demonstrations, and hands-on exercises. Participants will be given access to AutoCAD 2D software and sample drawings to practice on. The trainer will be available to answer questions and provide support throughout the program",,"[""To provide participants with a comprehensive understanding of the basics of AutoCAD 2D."", ""To help participants develop the skills needed to create basic 2D drawings with a high"", ""degree of precision and accuracy."", ""To teach participants how to use common tools and functions in AutoCAD 2D."", ""To provide participants with the skills needed to troubleshoot and resolve basic problems"", ""that may arise in AutoCAD 2D drawings.""]",[],Others,"[""PHYSICAL"",""ONLINE"",""HYBRID""]","[""PUBLIC"",""IN_HOUSE""]",APPROVED,0,,FALSE,FALSE,2,DAYS,FALSE,,,,,,,,04:45.3,04:45.3
e3d5cb70-22b1-475b-9196-4147c46774e3,2e1976a6-80d0-494b-9b72-339d2c5a3aa9,TR0005C5,Microsoft Excel Beginner Training,,"Welcome to the Excel Beginner Training program, your gateway to mastering essential spreadsheet skills. In this course, we'll delve into fundamental topics starting with Basic Data Entry, where you'll learn the ins and outs of inputting information accurately. We'll then explore the art of Data Formatting, guiding you in presenting your data with clarity and visual appeal. Formula Basics will empower you with calculation prowess, while strategies for Working with Rows and Columns ensure seamless data organization. As we journey further, you'll gain proficiency in Editing Worksheets, refining your data with precision, and conclude by mastering the intricacies of Printing Worksheets for effective on-screen and paper presentation. Whether you're a novice or an experienced user, this course is tailored to elevate your Excel skills, providing a solid foundation and refining your expertise. Join us for this transformative learning experience, and let's embark together on the path to Excel mastery!",,,Minimum Excel version is Microsoft Excel 2016,"[""The objectives of this 1-day training program are as follows:"", ""Develop proficiency in Basic Data Entry, ensuring accurate and organized"", ""information input for effective spreadsheet management"", ""Master Data Formatting techniques to present information visually and"", ""comprehensibly for enhanced data representation"", ""Acquire strategies for Working with Rows and Columns, enabling efficient data"", ""organization and manipulation within Excel"", ""Enhance skills in Editing Worksheets, empowering participants to modify and refine"", ""data with precision and efficiency""]",[],Software & Apps,"[""PHYSICAL"",""ONLINE"",""HYBRID""]","[""PUBLIC"",""IN_HOUSE""]",APPROVED,0,,FALSE,FALSE,1,DAYS,FALSE,,,,,,,,04:45.3,04:45.3
