id,trainer_id,course_code,title,certificate,description,target_audience,methodology,prerequisite,learning_objectives,learning_outcomes,category,course_mode,course_type,status,created_by_admin,course_sequence,created_by_admin.1,assessment,duration_hours,duration_unit,hrdc_claimable,modules,venue,price,fixed_date,start_date,city ,state,created_at,updated_at
00f763d1-fe5f-42ac-8501-498f58b221ea,,TR0016C1,MANAGEMENT SKILLS DEVELOPMENT,,"Leadership in the workplace refers to the ability of an individual to manage and/or supervise subordinates. It also refers to the ability to positively influence others to perform their jobs to the best of their ability which will result in the success for the organisation. Effective leaders will lead their team and that will be more likely to impact the decisions, actions, and overall attitude of others in a positive manner. When there is good morale and a positive working environment, the company is set up for success. However, to be an effective leader, it is important to note why do certain people react the way they do? How do I inspire people that is different from me? Why do people think the way they do? What are the motivation factors of people and how to identify them? Leadership today is very different from leadership in the past. Hence understanding who you are working with will tell you the right tools to lead the team. This program takes you through to understand people around you and how to manage / lead them effectively.",Executives Management teams Frontline staff Supervisory staff,"Training is delivered in a highly interactive and experiential way. Concepts and background information are presented through group exercises, discussion and activities creating an environment that facilitates accelerated learning and application. The trainer will facilitate discussion of real issues and challenges that the participants face in their work and private lives. Each activity will be thoroughly de-briefed to link the learning to real life situations. At the end of the program, participants will be provided with an assignment that they will be required to discuss within their groups and present during the Action Learning session (2 weeks after the program).",,"[""\""The following fundamental skills will be acquired in this program:"", ""Communicate not TALK learning how to profile the people in the team. Who s who"", ""and what is their language?"", ""Motivation filters How to identify motivation filters to enable the leader to know"", ""when to pressure and when to let go."", ""Persuading skills and techniques Understanding that certain words are more"", ""emotional compared to certain words. Learn them and know how to use them in your"", ""pitch to customers."", ""Evaluate participants would learn to see the patterns on where they did great and"", ""where can be improve, after a sale is made. If a sale did not happen, what when"", ""wrong? I always say ignore the mistakes and lose the greater teachers of all.\""""]","[""Upon completing this 2-day workshop, participants should be able to:"", ""Identify the people and get real insights into how and what kind of tools to use to"", ""push efficiency to the next level."", ""Install & Utilise, experience the theories and get real experience to immediately use"", ""them in their respective areas."", ""Design & Deliver a being able to use these persuading skills and language to get more"", ""results."", ""Take ownership and responsibility of their roles in the organization, become a"", ""proactive leader first to lead."", ""Create lasting change and the right attitude for personal success and organizational"", ""excellence""]",Communication & Languages,"[""PHYSICAL"",""ONLINE"",""HYBRID""]","[""PUBLIC"",""IN_HOUSE""]",APPROVED,0,,FALSE,FALSE,2,DAYS,FALSE,,,,,,,,04:45.3,04:45.3
cdb5d95c-abcc-4a13-9b1b-352013fda930,,TR0016C2,CUSTOMER SERVICE INTENSIVE DELIVERING THE WOW! (EVEN IN CRISIS),,"Customer service is all about creating a positive and lasting impression with your clients at the point of interaction with them. The key to gaining loyalty and attract potential clients, an organization must present world-class service to them. The 1 day program is designed for anyone who deals with customers on a day-to-day basis at work to deliver excellence in customer service. Our approach is to balance a strong process with the mindset, skills and behaviours that produce outstanding results. All activities are devised to be participative and interactive. The program will provide insight on the organizations ability to meet and surpass its customers needs and expectations.",,"Training will be delivered in a highly interactive and experiential way. Concepts and background information are presented through group exercises, discussion and activities creating an environment that facilitates accelerated learning. The trainer will facilitate discussion of real issues and challenges that the participants face in their work and private lives. Each activity will be thoroughly de-briefed to link the learning to real-life situations.",,"[""Understand and implement the Model of Service Excellence."", ""Dealing with change of environment and handling stress in it"", ""Highlight the key elements of service excellence that make the difference."", ""Build rapport and overcome the barriers that prevent it.""]",[],Software & Apps,"[""PHYSICAL"",""ONLINE"",""HYBRID""]","[""PUBLIC"",""IN_HOUSE""]",APPROVED,0,,FALSE,FALSE,1,DAYS,FALSE,,,,,,,,04:45.3,04:45.3
b600f16c-61bd-425a-879f-00e4b266b6b8,,TR0016C3,Coaching & Mentoring,,"A leader is someone who is able to lift up another. A leader is a guide, a teacher and a source of inspiration. Every leader is a good coach. This program focuses on how you can be an effective coach, mentor and source of inspiration to your team. To be an efficient leader is to be able to delegate effectively.","Executives, Management teams, Frontline staff, Supervisory staff,","Training is delivered in a highly interactive and experiential way. Concepts and background information are presented through group exercises & discussions. The trainer will facilitate discussion of real issues and challenges that the participants face in their work. This training is delivered in a virtual classroom setting and will be recorded for future reference. Program Value Proposition This program is not only theoretical, it is designed to be fully practical hands on and results oriented. Trainer will also be supporting the participants for 30 days to ensure full implementation and will be available on whatsapp to guide and mentor participants. This class is done virtually via zoom and is recorded. The recording will be made available for the participants for the next 30days so they can review. Trainer will also have a WhatsApp group to support the participants before, during and after the program for the next 30 days.",,"[""This program will incorporate the use of Neuro Action Learning to"", ""develop the skills to influence by having an understanding of the"", ""psychology of people and their communication model AND exactly"", ""what words to say to engage the other person s subconscious"", ""decision-making part of the brain."", ""The following fundamental NLP skills will be acquired in this"", ""program:"", ""Figuring Out People the ability to understand different"", ""aspects of behaviours within us and others and be flexible to"", ""get along with anybody at any time"", ""Building Rapport the ability to build sense of trust and"", ""engage comfortably with someone no matter how different"", ""they are to you."", ""Outcome Thinking the ability to consistently focus on the"", ""outcome""]","[""Upon completing this workshop, participants should be able to:"", ""Identify the different personality types"", ""Influence others and coaching them"", ""Create clear outcomes that your team can focus on achieving"", ""Strategise who and how to delegate tasks""]",Facilities Management & Maintenance,"[""PHYSICAL"",""ONLINE"",""HYBRID""]","[""PUBLIC"",""IN_HOUSE""]",APPROVED,0,,FALSE,FALSE,2,DAYS,FALSE,,,,,,,,04:45.3,04:45.3
e1c57f7c-a667-4c8b-809e-f4f9ab8cc026,,TR0016C4,Navigating Interpersonal Dynamics Dealing with Day-to-Day Challenges,,"In today's fast-paced and collaborative work environments, mastering effective interpersonal dynamics is crucial for personal and professional success. This program is carefully crafted to empower participants with the essential skills and strategies needed to navigate the complexities of daily interactions, foster positive relationships, and resolve conflicts adeptly. The two-day programs will delve into understanding various communication styles, honing active listening skills, and exploring the depths of emotional intelligence. Through interactive activities, role- playing, and real-world case studies, participants will have the opportunity to not only comprehend these concepts but also apply them in practical scenarios.","Executives, Managers, Business Owners, and Entrepreneurs","Trainer incorporates technologies learnt from Neuro Associative Conditioning, Neuro Action Technology, and fundamental Neuro Linguistic Programming with Action Learning to create an environment where participants will be fully engaged on both conscious and subconscious level. Training is delivered in a highly interactive and experiential way. Concepts and background information are presented through group exercises, discussion and activities creating an environment that facilitates accelerated learning and application. The trainer will facilitate discussion of real issues and challenges that the participants face in their work and private lives. Each activity will be thoroughly de-briefed to link the learning to real life situations.",,[],"[""Upon completing this workshop, participants will be able to:"", ""Recognize the importance of effective interpersonal dynamics in the"", ""workplace."", ""Identify the different personality types and some difficult behaviours."", ""Design and demonstrate the ability to influence behaviours by"", ""employing some simple skills."", ""Influence an effective on how to set a common approach and"", ""understanding for a collaborative workplace whilst eliminating bad"", ""and disruptive behaviour."", ""Overcome personal limitations when handling challenging situations.""]",Others,"[""PHYSICAL"",""ONLINE"",""HYBRID""]","[""PUBLIC"",""IN_HOUSE""]",APPROVED,0,,FALSE,FALSE,2,DAYS,FALSE,,,,,,,,04:45.3,04:45.3
12c7d4f7-d058-4344-b0c5-f69d6ed71153,0,TR0017C1,Excellence in Hotel Customer Service,,"This comprehensive 2-day training program is tailored for front-line staff in the hotel industry, equipping them with essential skills in time management and discipline. The course aims to elevate customer service standards by focusing on efficient task prioritization, effective communication, and cultivating a disciplined approach to work. Through a combination of interactive sessions, role- playing scenarios, and practical exercises, participants will gain the expertise needed to provide exceptional service in a hotel setting.","Front-line staff in the hotel industry, including but not limited to: Receptionists Concierge Guest Service Representatives Reservation Staff Front Desk Agents","The course employs a dynamic and participatory approach, incorporating a variety of instructional methods to cater to different learning styles: Interactive Lectures: Engaging presentations covering time management principles and disciplined work habits. Role-playing Scenarios: Real-life simulations of common hotel customer service situations for immediate application of skills. Feedback and improvement strategies for personalized development. Group Discussions: Facilitated discussions on challenges faced in time management and maintaining discipline. Sharing best practices and learning from peers. Case Studies: Analyzing real-world case studies to understand the impact of effective time management and disciplined work. Action Planning: Participants will develop personalized action plans for implementing learned skills in their daily roles. Encouraging a commitment to continuous improvement.",,"[""Time Management Proficiency:"", ""Develop effective time management strategies for handling diverse"", ""customer interactions."", ""Prioritize tasks to ensure optimal service delivery and customer satisfaction."", ""Discipline on Work:"", ""Instill a disciplined work ethic to enhance professionalism and"", ""consistency in customer service."", ""Cultivate habits and routines that contribute to a high level of service"", ""excellence.""]",[],Software & Apps,"[""PHYSICAL"",""ONLINE"",""HYBRID""]","[""PUBLIC"",""IN_HOUSE""]",APPROVED,0,,FALSE,FALSE,2,DAYS,FALSE,,,,,,,,04:45.3,04:45.3
7240e9a2-db9a-4282-95ca-2527ea2f2820,0,TR0017C2,Professional Customer Service Excellence in Logistics,"Certificate of Professional Customer Service
Excellence in Logistics","This intensive 2-day course is specifically designed for Customer Service Representatives in the logistics industry who engage in physical handling of customers. The program focuses on enhancing communication skills, building rapport, and addressing customer inquiries and complaints with professionalism. Through a blend of theoretical learning and practical exercises, participants will gain the necessary skills to elevate their customer service standards in a logistics setting.","Customer Service Representatives in the logistics industry who are involved in the physical handling of customers. This includes individuals from various generations (Gen Y, Gen X, Gen Z) and diverse racial backgrounds, with a focus on Malay and Indian participants.","The course employs a dynamic and participatory approach, combining theoretical sessions with hands-on exercises, role-playing scenarios, and interactive discussions. Practical application is emphasized to ensure that participants can immediately apply the skills learned in their daily interactions with customers. The training methodology is tailored to the logistics industry, providing relevant and industry-specific insights.",,"[""Fundamentals of Customer Service in Logistics:"", ""Understand the critical role of customer service in the logistics industry."", ""Recognize the impact of physical interactions on customer satisfaction."", ""Effective Communication Techniques:"", ""Develop verbal and non-verbal communication skills."", ""Learn to handle challenging customer interactions with professionalism."", ""Building Rapport and Trust:"", ""Acquire strategies for building strong rapport with customers."", ""Establish trust through empathetic and effective communication."", ""Handling Inquiries and Complaints:"", ""Master best practices for addressing customer inquiries."", ""Learn to handle complaints and turn challenges into opportunities."", ""Practical Application and Advanced Skills:"", ""Engage in interactive role-playing scenarios for real-world application."", ""Receive feedback and strategies for continuous improvement."", ""Cultural Sensitivity in Customer Service:"", ""Understand and respect diverse customer backgrounds."", ""Adapt communication styles based on cultural considerations."", ""Managing Difficult Situations:"", ""Develop strategies for de-escalating tense situations."", ""Maintain professionalism in challenging customer interactions."", ""Continuous Improvement:"", ""Create a personal action plan for ongoing improvement."", ""Foster a culture of continuous learning and development in customer service.""]",[],Facilities Management & Maintenance,"[""PHYSICAL"",""ONLINE"",""HYBRID""]","[""PUBLIC"",""IN_HOUSE""]",APPROVED,0,,FALSE,FALSE,2,DAYS,FALSE,,,,,,,,04:45.3,04:45.3
3cc4f992-c7ab-4a4f-aebc-adad73d55142,0,TR0017C3,Quality Assurance in Customer Service Mastery,,"This comprehensive 2-day course is tailored to equip frontline staff, Customer Relations and Development (CRD) teams, Sales and Marketing professionals, and Nursing staff with the skills required for effective uality Assurance in Customer Service ( ACS). Participants will delve into understanding customer expectations, mapping the customer journey, setting quality standards, and implementing proactive strategies for concurrent quality assurance.",This course is specifically crafted for: Front-liners involved in direct customer interactions. Customer Relations and Development (CRD) teams responsible for maintaining customer relationships. Sales and Marketing professionals engaged in customer acquisition and retention. Nursing staff interacting with patients and their families.,"The course employs a dynamic and engaging approach, combining theoretical knowledge with hands-on exercises, role-playing scenarios, and real-world case studies. Participants will actively participate in discussions, group activities, and practical exercises to ensure a holistic understanding of ACS principles. The methodology is designed to facilitate immediate application of learned concepts in the workplace.",,"[""Understanding Customer Needs:"", ""Recognize and analyze customer personas, behaviors, and expectations."", ""Comprehend the role of ACS in meeting and exceeding customer needs."", ""Mapping the Customer Journey:"", ""Develop a customer journey map to identify key touchpoints for quality assurance."", ""Align service quality standards with the various stages of the customer journey."", ""Setting and Meeting uality Standards:"", ""Define clear quality standards for customer interactions."", ""Implement strategies to consistently meet or exceed established standards."", ""Proactive Customer Engagement:"", ""Acquire techniques for proactive communication and issue resolution."", ""Apply effective communication in challenging customer scenarios."", ""Concurrent uality Assurance:"", ""Integrate quality assurance into daily operations for real-time monitoring."", ""Utilize technology tools to track and enhance customer service on an ongoing basis."", ""Continuous Improvement:"", ""Establish feedback loops and conduct customer surveys for continuous"", ""improvement."", ""Develop action plans based on feedback and industry best practices.""]",[],Communication & Languages,"[""PHYSICAL"",""ONLINE"",""HYBRID""]","[""PUBLIC"",""IN_HOUSE""]",APPROVED,0,,FALSE,FALSE,2,DAYS,FALSE,,,,,,,,04:45.3,04:45.3
94592223-5ed1-47a5-b599-4e50756bc05a,0,TR0018C1,Customer Experience in this Age of Digitization and Hyper Speed of Change,,,"Anyone who needs to interact effectively or build relationships with external or internal customers, including help desk, technical support, front-line or support staff.",,,"[""You Will Learn How To"", ""Adopt the skills and techniques that routinely deliver positive customer experiences"", ""Deal effectively with difficult customers and turn complaints into opportunities"", ""Demonstrate a positive, professional approach with internal and external customers""]",[],Soft Skills & Specialised Training,"[""PHYSICAL"",""ONLINE"",""HYBRID""]","[""PUBLIC"",""IN_HOUSE""]",APPROVED,0,,FALSE,FALSE,2,DAYS,FALSE,,,,,,,,04:45.3,04:45.3
939df79a-e25f-415b-afac-58b583a154ba,0,TR0018C2,NEGOTIATION SKILLS,,"Are you overlooked in meetings? Do your colleagues consistently ignore your ideas? Do you struggle to convert prospects to clients? Can you successfully persuade others to understand your thinking and ideas? To be as effective as possible as an employee, you may need to influence others whether this is a client, a manager or a colleague. This course is strategically designed to assist you in harnessing the skills you need to be more influential and persuasive in the workplace. Whether youre a new manager or wish to increase or refresh your existing skills, this course has been strategically designed to suit all levels of experience. The Training Methodology involves Case Studies, Group Negotiation activities, Role Plays and Discussions. This training course combines the interrelated skills of negotiation, persuasion, influence and communication. In the business environment, competition is fierce and you need all the tools you can get to enable you to gain a competitive advantage.","Managers and Executives at all levels who want to improve their communication skills. This course is also aimed at those who want to increase their competitive advantage through the powers of persuasion, influence and negotiation",,,"[""At the end of the program, participants will be able to:"", ""Recognise other people s personality type and communication"", ""preferences, tendencies and needs"", ""Adjust their own communication approach with their increased awareness of"", ""their own styles and other peoples needs"", ""Identify barriers to communication and"", ""how to overcome them"", ""Develop their non-verbal and para verbal"", ""communication skills"", ""Use the S.T.A.R. method to speak on the"", ""spot"", ""Establish credibility and present their ideas"", ""using proven persuasion techniques to gain"", ""the support of others""]",[],Communication & Languages,"[""PHYSICAL"",""ONLINE"",""HYBRID""]","[""PUBLIC"",""IN_HOUSE""]",APPROVED,0,,FALSE,FALSE,2,DAYS,FALSE,,,,,,,,04:45.3,04:45.3
2c806f8d-0125-4b6a-816c-9c86e7605c22,17ea9404-124d-4ad7-8b21-ba20cf92b182,TR0019C1,Creating a Customer-Centric Mindset,,"Having a customer-oriented mindset is very important for the organization. Customer Satisfaction is a key area to ensure the success of a company. Therefore, it is vital that all staff are equipped with essential skills to manage any type of customer professionally. Internally the spirit of customer service must be embraced so teams can work together to achieve a common service vision. As such this workshop encourages participants to wear their service hat at all times. This workshop equips participants with tried and tested methods to manage all types of customers. The workshop is highly interactive, and it uses exciting methodologies to draw insights from participants. The module outline has been designed as a 2-day workshop. However, this can be customized to suit the requirements of the clients.",,Group Discussions Sample Call audit & Review Listening Exercises Role Plays & Simulation Exercises based on situations at work Video Facilitator & Peer Feedback Experience Sharing Games,,"[""To identify & develop the service vision of the company as a common goal."", ""To understand how one s role impacts customer satisfaction."", ""Identify the difference between internal and external customers."", ""To develop key communication skills to understand & communicate effectively."", ""To apply proven techniques for handling difficult customers""]",[],Communication & Languages,"[""PHYSICAL"",""ONLINE"",""HYBRID""]","[""PUBLIC"",""IN_HOUSE""]",APPROVED,0,,FALSE,FALSE,1,DAYS,FALSE,,,,,,,,04:45.3,04:45.3
7d330eb4-358c-40b3-aca5-b586c65ed32a,17ea9404-124d-4ad7-8b21-ba20cf92b182,TR0019C2,Creating a Customer-Centric Mindset,,"Having a customer-oriented mindset is very important for the organization. Customer Satisfaction is a key area to ensure the success of a company. Therefore, it is vital that all staff are equipped with essential skills to manage any type of customer professionally. Internally the spirit of custom- er service must be embraced so teams can work together to achieve a common service vision. As such this workshop encourages participants to wear their service hat at all times.. This workshop equips participants with tried and tested methods to manage all types of customers. The workshop is highly interactive, and it uses exciting methodologies to draw insights from partic- ipants. The module outline has been designed as a 2-day workshop. However, this can be customized to suit the requirements of the clients.",,Group Discussions Sample Call audit & Review Listening Exercises Role Plays & Simulation Exercises based on situations at work Video Facilitator & Peer Feedback Experience Sharing Games,,"[""To identify & develop the service vision of the company as a common goal."", ""To understand how one s role impacts customer satisfaction."", ""Identify the difference between internal and external customers."", ""To develop key communication skills to understand & communicate effectively."", ""To identify customer personalities over the phone and ways to communicate professionally with"", ""different types of customers."", ""To apply proven techniques for handling difficult customers"", ""To create a service culture for continuous improvement""]",[],Communication & Languages,"[""PHYSICAL"",""ONLINE"",""HYBRID""]","[""PUBLIC"",""IN_HOUSE""]",APPROVED,0,,FALSE,FALSE,2,DAYS,FALSE,,,,,,,,04:45.3,04:45.3
