id,trainer_id,course_code,title,certificate,description,target_audience,methodology,prerequisite,learning_objectives,learning_outcomes,category,course_mode,course_type,status,created_by_admin,course_sequence,created_by_admin.1,assessment,duration_hours,duration_unit,hrdc_claimable,modules,venue,price,fixed_date,start_date,city ,state,created_at,updated_at
6baa01d9-f5d7-432f-a345-2d082c7c5f9e,c392c5f7-8a7e-4393-be48-5538e0d822e0,TR0092C11,"EFFECTIVE COMMUNICATION, CONFLICT RESOLUTION",CERTIFICATE OF ATTENDANCE,"This program will take participants through the methods of Effective Communication, Conflict Resolution & Facilitation Skills at workplace so that they can start applying them, building self-esteem, and gaining confidence to start to improve self-confidence and inspire actions that lead to team success. It provides participants with the skills and knowledge needed to effectively navigate conflicts in the workplace and maintain a positive work environment. Mastering Essential Facilitation Skills training is to enhance an employee's ability to facilitate meetings and workshops,planand execute projects, and delegate tasks effectively. This training program focuses on developing skills and knowledge in various areas, such as group dynamics, prioritization, time management, and decision-making",Private Sector Industries or any Government Agencies a. This program is designed for Executive and above employees group.,"a. Training will be delivered in a mix activity of experiential learning such as games, quiz, presentation, demo. Every activity is carefully selected to enhance the learning experience and relates to the application in participant environment. b. Participant will be exposed to the Effective Communication, Conflict Resolution & Facilitation Skills and relates to building confidence indaily communication that will lead to higher productivity and brings harmony at work pace. c. All learning elements will be carefully planned so participant will get the opportunity to perform the thought techniques in class through role plays and case studies that relates to each individual industry application",,"[""Participant will be exposed to the benefit of leveraging on Effective"", ""Communication, Conflict Resolution & Facilitation Skills that will prepare"", ""participants communicate more confidently and improve"", ""interpersonal relationship among stakeholders."", ""All learning elements will be carefully planned so participant will"", ""get the opportunity to perform the thought techniques in class"", ""through role plays, games, video takeaway, group discussion,"", ""and case studies that relates to each individual working"", ""experience, knowledge, skill level."", ""At the end of each session, trainer will review the"", ""participant understanding through review, Q&A"", ""and summarize the session together with"", ""participant.""]",[],Human Resource,"[""PHYSICAL"",""ONLINE"",""HYBRID""]","[""PUBLIC"",""IN_HOUSE""]",APPROVED,0,,FALSE,FALSE,2,DAYS,FALSE,,,,,,,,04:45.3,04:45.3
b2304e13-d316-4134-b0dc-6fede0b08367,,TR0093C1,"COSTING TECHNIQUES & CONTROL, PRICING DECISIONS, BUDGETING",CERTIFICATE OF ATTENDANCE,"Every companys survival and progress, depends on the basis of proper estimation of its costs and estimation of product or service pricing. Every cost conscious executive, specific project manager, cost estimator, planner or organization is in need of improving their cost estimation success. This seminar endeavors to illustrate and explain how to develop costs and how they can be used not only to estimate the product cost, but also how to use them to determine a competitor's likely bid price. It explores the estimating methods typically used to estimate costs and explains the advantages and disadvantages of each, demonstrate several estimating methods, and includes a cost estimating methodology that participants can tailor to their own organizational needs.","Cost and Accounts Executives, Managers, Directors, Planners and Analysts","Lectures, power-point presentation, case studies, participants interaction",,"[""Describe costs by classification;"", ""Identify appropriate cost elements;"", ""Explain and understand the role of management accounting within an organization and the importance for the requirement of management decision making information;"", ""Demonstrate knowledge and application of the principles of management accounting, in planning, monitoring, pricing, and various decision making processes, that are deemed to reduce risk factors related to the organization""]","[""Able to classify and describe various types of costs (e.g., fixed, variable, direct, and indirect) within an organization."", ""Comprehend the role of management accounting in an organization and its significance in providing relevant information for strategic decision-making."", ""Able to assess and mitigate risk factors related to organizational operations through informed management accounting practices.""]",Software & Apps,"[""PHYSICAL"",""ONLINE"",""HYBRID""]","[""PUBLIC"",""IN_HOUSE""]",APPROVED,0,,FALSE,FALSE,2,DAYS,FALSE,,,,,,,,04:45.3,04:45.3
211e18b8-66a3-4840-9cbf-cbf7fd9435de,725d3d4a-b524-4848-82eb-12693100b885,TR0095C1,COMMUNICATION AND INTERPERSONAL SKILLS,CERTIFICATE OF ATTENDANCE,"In one day, we spent most of the time at work accomplishing our task and target. At the same time, we are also dealing with challenging and changed situation. All the above require effective communication and interpersonal skills in managing ourselves and managing others expectation. No matter in the meeting to a group of people, one to one in a discussion, or having a telephone conversation; having the right mindset and attitude towards building good rapport in communication is important.",Executive,Group Discussion and Presentation Interactive Session & Role Play Activities Video Learning,,"[""Enhance confidence in dealing with people with different personality."", ""Establish skills in building rapport to create a win-win situation."", ""Understand the correct technique in communication that helps you in negotiation, conflict resolution and more.""]","[""Define Negotiation: Understand the concept of negotiation and its significance in both personal and professional settings."", ""Identify the 4 Stages of a Win-Win Negotiation: Demonstrate knowledge of the four key stages involved in achieving a win-win outcome in negotiations, and apply these stages"", ""in practical negotiation scenarios."", ""Apply the Burger Approach to Feedback: Utilize the Burger Approach to deliver constructive feedback effectively, balancing positive reinforcement with areas for improvement"", ""in a way that encourages growth and development.""]",Facilities Management & Maintenance,"[""PHYSICAL"",""ONLINE"",""HYBRID""]","[""PUBLIC"",""IN_HOUSE""]",APPROVED,0,,FALSE,FALSE,2,DAYS,FALSE,,,,,,,,04:45.3,04:45.3
0c37c20d-e6a1-415e-b50e-a695880be22c,725d3d4a-b524-4848-82eb-12693100b885,TR0095C2,HIGH-IMPACT SALES TECHNIQUES: CLOSING DEALS EFFECTIVELY,CERTIFICATE OF ATTENDANCE ,"In todays competitive market, sales professionals in channel and distribution environments must go beyond transactional selling. High-impact consultative selling emphasizes building trust, uncovering real customer needs, and presenting tailored solutions that create long-term business partnerships. This program provides a practical framework through the 5-step consultative selling process, equipping participants to help distributors, resellers, and agents overcome common sales challenges, drive stronger results with end customers, and close deals more effectively. Participants will also learn how to deliver a compelling value proposition, handle objections with confidence, and position products as complete business solutions rather than simple commodities",Executive level and above in Selling and Consulting,On the spot coaching session for immediate feedback and improvement Group Discussion and Presentation Interactive Session & Role Play Activities Video Learning,,"[""Equip sales professionals with consultative selling skills to build stronger relationships, understand customer needs, and drive sustainable sales growth in channel and distribution environments."", ""Shifting from a push-based approach to a consultative mindset, fostering stronger relationships and sustainable revenue growth in channel sales."", ""Practical action plan to implement consultative selling techniques, enhancing the ability to influence decisions and drive mutual success with partners""]",[],Sales & Marketing,"[""PHYSICAL"",""ONLINE"",""HYBRID""]","[""PUBLIC"",""IN_HOUSE""]",APPROVED,0,,FALSE,FALSE,2,DAYS,FALSE,,,,,,,,04:45.3,04:45.3
19746808-2572-4c73-ae6c-bc5733f98dd7,725d3d4a-b524-4848-82eb-12693100b885,TR0095C3,THE WINNING WAY IN SELLING: A PRACTICAL APPROACH TOWARDS SOLUTION SELLING,CERTIFICATE OF ATTENDANCE,"In every sales meeting and presentation, we are there to provide the best to our client. Winning a negotiation in getting the client to say YES as an agreement to buy our products and/or services is about achieving a win-win situation in offering the right solution to client. Our action determines our sales success. No matter what are the products you are dealing with, in a negotiation session; it is all about managing client expectation with the right technique in communication, presentation and closing the sales.",Executive level and above in Selling and Consulting,On the spot coaching session for immediate feedback and improvement Group Discussion and Presentation Interactive Session & Role Play Activities Video Learning,,"[""Getting the right techniques in handling objection and closing sales"", ""Be ready and prepare to communicate and convince the client in a sales negotiation"", ""session."", ""Understand and managing the expectation of different personality of client that we are dealing with.""]","[""Effectively Handle Objections and Close Sales"", ""Prepare and Deliver Persuasive Sales Presentations"", ""Identify and Manage Client Expectations Based on Personality Types"", ""Use Advanced Negotiation Techniques to Drive Sales Success""]",Sales & Marketing,"[""PHYSICAL"",""ONLINE"",""HYBRID""]","[""PUBLIC"",""IN_HOUSE""]",APPROVED,0,,FALSE,FALSE,2,DAYS,FALSE,,,,,,,,04:45.3,04:45.3
2c018768-ff28-4af5-b0d0-1e1e994f5ef0,725d3d4a-b524-4848-82eb-12693100b885,TR0095C4,Communication and Interpersonal Skills,,"In one day, we spent most of the time at work accomplishing our task and target. At the same time, we are also dealing with challenging and changed situation. All the above require effective communication and interpersonal skills in managing ourselves and managing others expectation. No matter in the meeting to a group of people, one to one in a discussion, or having a telephone conversation; having the right mindset and attitude towards building good rapport in communication is important.",Executive,Group Discussion and Presentation Interactive Session & Role Play Activities Video Learning,,"[""Enhance confidence in dealing with people with different personality."", ""Establish skills in building rapport to create a win-win situation."", ""Understand the correct technique in communication that helps you in negotiation, conflict resolution and more""]",[],Facilities Management & Maintenance,"[""PHYSICAL"",""ONLINE"",""HYBRID""]","[""PUBLIC"",""IN_HOUSE""]",APPROVED,0,,FALSE,FALSE,2,DAYS,FALSE,,,,,,,,04:45.3,04:45.3
f60aeca6-4dfb-4e25-b028-b67c43b4ec71,725d3d4a-b524-4848-82eb-12693100b885,TR0095C5,Consultative Selling: Building Trust and Driving Results,,"In Consultative Selling, every sales professional must be equipped with the essential skills and framework that specifically tailored for channel sales and distribution environments. Unlike traditional transactional selling, consultative selling focuses on building trust, understanding customer needs, and offering tailored solutions that drive long-term partnerships. Practical approach on the 5-step consultative selling process are important to address challenges faced by business partner [distributors/reseller/agents] in generating better sales results to end user [customer]. At the same time, it is also about practicing a compelling value proposition, handling objections, and positioning products as business solutions rather than mere commodities.",Executive level and above in Selling and Consulting,On the spot coaching session for immediate feedback and improvement Group Discussion and Presentation Interactive Session & Role Play Activities Video Learning,,"[""Equip sales professionals with consultative selling skills to build stronger relationships, understand customer needs, and drive sustainable sales growth in channel and distribution environments."", ""Shifing from a push-based approach to a consultative mindset, fostering stronger relationships and sustainable revenue growth in channel sales."", ""Practical action plan to implement consultative selling techniques, enhancing the ability to influence decisions and drive mutual success with partners""]",[],Facilities Management & Maintenance,"[""PHYSICAL"",""ONLINE"",""HYBRID""]","[""PUBLIC"",""IN_HOUSE""]",APPROVED,0,,FALSE,FALSE,1,DAYS,FALSE,,,,,,,,04:45.3,04:45.3
e34d43ae-a0e3-4758-a8ae-3cdf984db163,725d3d4a-b524-4848-82eb-12693100b885,TR0095C6,Customer Experience for Service Excellence,,"Customers have many choices! If they are happy with the way they are treated, they will stay with you. With the fast changing of technologies and trend in todays global economy, providing better customer service is compulsory and necessity. All of us are doing that. At the same time, are we doing our best in an amazing way? Customers may first come into your business because of your product and/or service, and they will decide to come again based on how well they are treated. That is where we move beyond service in giving a better experience by having them as our customer. Moving beyond service from reactive to proactive in providing better customer experience is the key to service excellence.",F&B Service Crew Customer Care Consultant Service Advisors Telemarketers Executive level and above,On the spot coaching session for immediate feedback and improvement Group Discussion and Presentation Interactive Session & Role Play Activities Video Learning,,"[""State what customer experience means in relation to all your customers, both internal and external"", ""Identify your customers needs & expectation"", ""Increase productivity, efficiency and effectiveness in providing customer experience to generate return business"", ""Dealing with difficult customers in a professional attitude""]",[],Software & Apps,"[""PHYSICAL"",""ONLINE"",""HYBRID""]","[""PUBLIC"",""IN_HOUSE""]",APPROVED,0,,FALSE,FALSE,2,DAYS,FALSE,,,,,,,,04:45.3,04:45.3
8100c8d0-f572-445c-997a-9d08062bbe84,725d3d4a-b524-4848-82eb-12693100b885,TR0095C7,Dynamic Presentation Workshop,,"Be yourself and you can give a dynamic presentation that will add value to your audience. There is no need to copy the style of another presentation because you are gifted in your own way. Presentation skills can be learn and develop. As long as you take action with the right practice, you are on the right track. Being able to engage your audience is important to ensure you deliver the right message to them in getting the result you desire.",Executive level and above Anyone that wanted to improve and enhance their presentation skills,Individual and Group Presentation Video Learning Activities,,"[""Develop better skills and understanding in presentation"", ""Effective way to engage your audience and leave a lasting impression"", ""Discover the techniques presenting dynamically in any situation."", ""Able to enhance your presentation with humour, props and more resources."", ""Get to know the real you in presentation and how you can do better. [video recording]""]",[],Communication & Languages,"[""PHYSICAL"",""ONLINE"",""HYBRID""]","[""PUBLIC"",""IN_HOUSE""]",APPROVED,0,,FALSE,FALSE,2,DAYS,FALSE,,,,,,,,04:45.3,04:45.3
a65bd3bd-a6a6-45bb-8422-72682d0429f4,725d3d4a-b524-4848-82eb-12693100b885,TR0095C8,Effective Sales Negotiation,,"In every sales meeting and presentation, we are there to provide the best to our client. Winning a negotiation in getting the client to say YES as an agreement to buy our products and/or services is about achieving a win-win situation. Our action determines our sales success. No matter what are the products you are dealing with, in a negotiation session; it is all about managing client expectation with the right technique in communication, presentation and closing the sales",Executive level and above in Selling and Consulting,On the spot coaching session for immediate feedback and improvement Group Discussion and Presentation Interactive Session & Role Play Activities Video Learning,,"[""Getting the right techniques in handling objection and closing sales"", ""Be ready and prepare to communicate and convince the client in a sales negotiation session."", ""Understand and managing the expectation of different personality of client that we are dealing with.""]",[],Sales & Marketing,"[""PHYSICAL"",""ONLINE"",""HYBRID""]","[""PUBLIC"",""IN_HOUSE""]",APPROVED,0,,FALSE,FALSE,2,DAYS,FALSE,,,,,,,,04:45.3,04:45.3
7238bfd6-02f0-49d6-bb9d-d6c88a9e1ada,725d3d4a-b524-4848-82eb-12693100b885,TR0095C9,Leadership in Action - for Managers and Supervisors,,"Leading others can be a tough job. Between managing your own time and projects, helping your team members solve problems and complete tasks, and helping other in their development, your day can fill up before you know it. Leadership in Action will help Managers and Supervisors become more efficient and proficient, with information on delegating, managing time, setting goals and expectations (for themselves and others), providing feedback, resolving conflict, and administering discipline.",Supervisor Junior Manager Management Trainee Anyone that manage a department staff and leading them to the desire result of an organization,Group Discussion and Presentation Interactive Session Activities Video Learning,,"[""Understanding the responsibilities of a Leader"", ""Be an effective communicator to all levels of team member in the organisation"", ""Prioritisation of task in Planning, Organize, Monitor, Evaluate and Motivate"", ""Be proactive and reactive in different situation in managing the expectation of others"", ""Build up the good skills as a leader"", ""Be a problem solver and effective decision maker""]",[],ISO,"[""PHYSICAL"",""ONLINE"",""HYBRID""]","[""PUBLIC"",""IN_HOUSE""]",APPROVED,0,,FALSE,FALSE,2,DAYS,FALSE,,,,,,,,04:45.3,04:45.3
937e01f5-e8b9-425b-b87f-65952c7d17aa,725d3d4a-b524-4848-82eb-12693100b885,TR0095C10,Experiential Selling Skills in Retail,,"Retail industry is fast moving and changing all the time. Selling and generating profit is important for every organization. Managing customer expectation is everyone task in a retail outlet. It is also to ensure every staff are well equip with the right sales mindset to achieve and exceed the sales target. Challenges in selling are part of the process and it is all about having the right mindset to overcome it. As long as you are prepare and fully practicing the skills and knowledge, you are just there for the customer in helping them to enjoy a wonderful experience in your outlet.",Sales Executive and Advisor in Retail industry Anyone who is the in the sales industry Anyone who got to handle or manage customer expectation,Group Discussion and Presentation Interactive Session Activities Video Learning,,"[""Gain a good understanding of what it takes to be a successful salesperson"", ""Gain new skill and enhance existing skills in selling."", ""Building trust and rapport with every walk in customer into generating refer and repeat sales.""]",[],Facilities Management & Maintenance,"[""PHYSICAL"",""ONLINE"",""HYBRID""]","[""PUBLIC"",""IN_HOUSE""]",APPROVED,0,,FALSE,FALSE,2,DAYS,FALSE,,,,,,,,04:45.3,04:45.3
cd7c3e4c-e2ba-46c4-91a3-02d2e20f6816,fa16f9b0-fe86-4ab5-b0c4-2ae5d010d122,TR0096C1,HUMAN RESOURCE POLICIES AND STAFF HANDBOOK,CERTIFICATE OF ATTENDANCE ,"Human Resource (HR) policies and the Staff Handbook are essential tools for managing employees and ensuring a smooth, organized workplace. These documents outline the rules, expectations, and rights of both employees and the organization.",HR Managers and HR Professionals Supervisors and Team Leaders Line Managers Business Owners and Entrepreneurs Employees,"Methodology: Lectures/Presentations: Provide an overview of key HR policies and the structure of the staff handbook through clear, informative presentations. Group Discussions: Engage participants in discussions about the importance of HR policies and how they impact workplace culture and compliance. Case Studies: Present real-life scenarios that highlight the application of HR policies and the staff handbook in resolving workplace issues. Role-Playing Exercises: Have participants practice handling employee concerns or enforcing policies using role-play to develop practical skills. Interactive Q&A Sessions: Encourage participants to ask questions about policies, legal compliance, and the use of the handbook in various situations. Workshops/Hands-On Activities: Guide participants through creating or updating sections of a staff handbook to reinforce understanding. Quizzes or Assessments: Use quizzes to test participants knowledge and retention of key HR policies and procedures.","Basic Understanding of HR Functions: Participants should have a general knowledge of human resource management and its role in an organization. Familiarity with Workplace Policies: It is helpful for participants to be familiar with basic workplace policies such as attendance, leave, and employee conduct. Awareness of Employment Laws: A basic understanding of relevant labor laws and regulations, especially in the context of the specific country, is beneficial. Current Role Involvement: Participants should be in, or aspiring to be in, roles related to HR, management, or supervisory functions where HR policies are relevant.","[""Understand the purpose and importance of HR policies in an organization."", ""Recognize how HR policies ensure legal compliance and fairness in the workplace."", ""Learn the key components of a staff handbook and its role in communicating company policies."", ""Identify how the staff handbook supports employee onboarding and day-to-day operations."", ""Know how to use HR policies and the staff handbook to resolve workplace issues.""]","[""Ability to explain the purpose and benefits of HR policies within an organization."", ""Confidence in applying HR policies to ensure legal compliance and consistency in the workplace."", ""Familiarity with the structure and content of a staff handbook."", ""Competence in using the staff handbook to guide employees on workplace expectations and"", ""procedures."", ""Capability to resolve common workplace issues by referring to relevant HR policies and the staff"", ""handbook.""]",Human Resource,"[""PHYSICAL"",""ONLINE"",""HYBRID""]","[""PUBLIC"",""IN_HOUSE""]",APPROVED,0,,FALSE,FALSE,2,DAYS,FALSE,,,,,,,,04:45.3,04:45.3
7c1049bd-18ec-4f56-b733-54525380e790,fa16f9b0-fe86-4ab5-b0c4-2ae5d010d122,TR0096C2,MEMAHAMI ASAS INDUSTRIAL RELATIONS DAN EMPLOYEERELATIONS DI TEMPAT KERJA,,,,,,[],[],Others,"[""PHYSICAL"",""ONLINE"",""HYBRID""]","[""PUBLIC"",""IN_HOUSE""]",APPROVED,0,,FALSE,FALSE,2,DAYS,FALSE,,,,,,,,04:45.3,04:45.3
